mart_name,positioning,verified_strengths,likely_best_for,field_observations_to_keep,seems_weak_for,verification_status,source_basis
El Corte Inglés Serrano,"백화점형 프리미엄 식료품 거점","Gourmet Experience, supermarket support line, premium/gift-friendly environment","관광객, 선물용 하몽·올리브오일·와인, 정돈된 쇼핑","일식 재료가 의외로 다양함, 가격 차이가 생각보다 크지 않음, 밀키트는 약한 편","생활형 가성비 장보기, 냉동·즉석식품 중심 구매","partially_verified","Official site confirms Gourmet Experience, restaurants, and supermarket support; Japanese assortment and price impression remain field notes."
Mercado de la Paz,"시장형이지만 프리미엄 감각이 강한 로컬 푸드 마켓","Fresh food focus, around 60 establishments, ham/cheese/seafood-friendly market positioning, online market service","관광객, 현지 식재료 탐색, 빠에야 재료, 하몽·치즈","백화점보다 훨씬 시장스럽지만 생각보다 고급 느낌도 강함, 한국 기준 백화점과 시장의 격차가 예상보다 작게 느껴짐","생활용품 원스톱 쇼핑, 냉동식품 중심 장보기","mostly_verified","Official site confirms fresh-food focus, selective delicacies, and broad stall mix; premium feel vs department store is still an interpretation from visit."
Sánchez Romero,"정돈된 프리미엄 슈퍼마켓","Gourmet selection, wine cellar, fresh/gourmet/pantry categories, premium shopping experience","중상급 식재료, 와인, 치즈, 깔끔한 쇼핑 동선","비싼 하몽·치즈·와인이 눈에 띄고 정돈이 잘 되어 있었음, 다만 압도적 메리트는 약하게 느껴짐","생활형 가성비 장보기, PB 중심 쇼핑","mostly_verified","Official site confirms gourmet positioning, bodega, fresh/gourmet/pantry categories and premium experience; '큰 메리트 없음' is a field note."
Mercadona,"생활형 실속 슈퍼마켓","Strong own-brand orientation, urban proximity supermarket model, ready-to-eat/Listo para Comer reputation","유학생, 장기 체류자, PB상품, 생활 장보기, 반복 구매","생활형 장보기에서 가장 무난한 기준점 역할","프리미엄 선물용 탐색, 시장형 식재료 경험","partially_verified","Secondary sources consistently describe strong own brands Hacendado/Bosque Verde/Deliplus and prepared-food expansion; branch-level assortment still needs field verification."
Carrefour Express,"근거리 실용형 편의 슈퍼마켓","Longer opening hours, fresh and frozen foods, beverages, household items, online/click&collect ecosystem","늦은 시간 장보기, 냉동식품, 즉석식품, 생활용품 보충","선택 매장은 오후 11시까지라 비교군 중 가장 늦게까지 열고, 백화점보다 냉동·조리식품 가격 메리트가 체감됨","프리미엄 기념품 구매, 해산물·시장형 신선식품 탐색","mostly_verified","Official Carrefour page confirms quick-meal use case, fresh/frozen foods, beverages and household goods; price advantage vs department store is a field note."
